category,text,summary
entertainment,"Rocker Doherty in on-stage fight

Rock singer Pete Doherty has been involved in a fight with his band's guitarist at their biggest gig to date.

Babyshambles played for 5,000 fans at London's Brixton Academy on Tuesday. The former Libertines singer traded blows with guitarist Patrick Walden. They were separated and bundled off stage before returning to end the set. The show was earlier held up due to audience overcrowding. On Monday Doherty faced blackmail and robbery charges in court, which he denies. He is out on £50,000 bail and the judge agreed to extend his 2200 GMT curfew deadline by two hours so he could play the Brixton gig.

Babyshambles, which he formed after his acrimonious departure from the Libertines, played a warm-up show at The Garage, north London, on Monday. On Tuesday, Doherty and his three bandmates were introduced to the crowd by Mick Jones, the former Clash guitarist who produced the Libertines' second album. Babyshambles took the stage to a frenzied reception at 2200 GMT, launching into their last single, Killamangiro, which reached number eight in December. But the group had to stop during the next song to persuade fans not to push forward and allow security guards to pull people out of the crush. Doherty appealed to fans to calm down, saying: ""There's a few people getting hurt down the front, you've got to move back.""

The music resumed minutes later but after several more songs, the singer appeared to accidentally disconnect Walden's guitar, leading the pair to trade kicks and punches. Bouncers stepped in and the band left the stage, but returned after five minutes and finished their 50-minute performance with no further trouble. Doherty, 25, had to be home by midnight to observe the curfew, which is one of the conditions of his bail. On Monday, the judge agreed to allow him to perform on condition that requests for changes to his bail terms were ""not too regular an occurrence"". The singer was arrested with fellow musician Alan Wass on 2 February after an alleged dispute with documentary-maker Max Carlish at a London hotel. They are next due in court on 18 April.
"," Pete Doherty traded blows with guitarist Patrick Walden at Brixton Academy gig . The pair were separated and bundled off stage before returning to end the set . The show was earlier held up due to audience overcrowding . Doherty faced blackmail and robbery charges in court, which he denies ."
entertainment,"Top gig award for Scissor Sisters

New York band Scissor Sisters have won a gig of the year award for their performance at this year's V Festival.

The award was voted for by listeners of Virgin Radio, which compiled a top 10 which was mostly dominated by newcomers on the music scene this year. The quirky disco-rock band beat The Red Hot Chili Peppers who came second for their Hyde Park performance in June. Virgin Radio DJ Pete Mitchell said: ""This year has seen an amazing array of talent come into the mainstream."" He added: ""The Scissor Sisters are one of the most original, eccentric bands to come through and it's no surprise the British public are lapping up their performances."" Newcomers Keane came in third place for their August gig at the V Festival, followed by Maroon 5 and Snow Patrol.

Music veterans The Who and David Bowie, both earned places on the list, at number eight and 10 respectively. At number seven was Oxfam's Make Fair Trade gig at London's Hammersmith Apollo in October, which featured performances by REM, Razorlight and Coldplay's Chris Martin. Glasgow's Franz Ferdinand earned a place at number nine for their home-town performance in April. The annual survey was voted for by nearly 4,000 listeners.
"," Newcomers The Red Hot Hot Band beat the likes of Maroon 5 and The Who at number nine . The award was voted for by nearly 4,000 listeners . The band is one of the favourites to win the award for their performances ."
entertainment,"How the Academy Awards flourished

The 77th annual Academy Awards are taking place on 27 February with the stars of the movie-making world once again holding their breath to discover who will be showered with the honours this year. But from humble beginnings, how did the modern day extravaganza become the behemoth it is today?

HOW IT ALL STARTED The first Academy Awards were handed out in 1929 at a comparatively low-key dinner held at the Hollywood Roosevelt Hotel - just over the road from their modern day home.

Just 250 guests attended with ticket prices at $5.

The first film to win was Wings, which starred Clara Bow in the only silent movie to win the big award. For the first 10 years or so, the winners list was handed to the newspapers so they could publish them at 11pm, but in 1940 the winners were published in the Los Angeles Times at 8.45pm meaning guests entering the ceremony knew already knew the results. As a result the sealed envelope system was introduced, leading to the secrecy and suspense-filled night that happens today. WHEN AND WHERE The tradition of holding the awards at a banquet continued until 1942 but with increasing interest came a growing guest list and it became impractical to host it as a dinner.

The ceremonies were then transferred to theatres with the famous Grauman's Chinese Theatre the first to host the expanded event. Other venues included the Dorothy Chandler Pavilion and the Shrine Auditorium. They are now held at the Kodak Theatre, which opened in 2002 just across the road from its original home and holds 6,000 people. Until 1954 they were held on a Thursday, then swapped around from Monday to Wednesday before Sunday night was settled on, although the month swapped from May to April to March and now its current month of February. The first televised ceremony was in 1953, with Bob Hope as the MC. WHO WAS OSCAR? There is no solid evidence as to how the trophy became to be known as Oscar.

One popular story is that Academy librarian Margaret Herrick said the statue looked like her uncle Oscar. A journalist apparently overheard this conversation and used the phrase in an article.

The first time it is thought to have been used in print was when columnist Sidney Skolsky used it to describe Katherine Hepburn's first best actress win in 1934. The Academy officially adopted the nickname in 1939. The trophy was designed by MGM art director Cedric Gibbons. Since its inception 2,530 Oscars have been handed out. In support of the war effort, the Academy handed out plaster Oscar statuettes during WWII. After the war, winners exchanged the plaster awards for the real thing. Fifty-five statues were stolen in en route to the awards in 2000, 52 were recovered nine days later. Winners were unaffected as a new batch was rushed out. WHO SITS IN JUDGEMENT? The Academy was set up in 1927 as a non-profit organisation with 36 members from different film disciplines. Douglas Fairbanks Sr was the first president and oversaw the first awards. There are now 5,700 members of the Academy - with membership by invitation only to those who are seen to have achieved distinction in the movies and are therefore seen as fit to judge their peers. Some of the criteria for admittance includes: film credits that reflect the high standards of the Academy, receipt of an Academy Award nomination, achievement of unique distinction, earning of special merit, or making an outstanding contribution to film. THE STARS WHO LEFT EMPTY-HANDED While many of the biggest films and movie-makers have been honoured by the Academy, there is still surprise at those that did not receive any nominations that later went on to become classics.

Among the overlooked films were Hobson's Choice, Dirty Harry, The 39 Steps, The Searchers and King Kong. Actors that failed to win for their iconic roles included Al Jolson in the Jazz Singer (1927), Humphrey Bogart in Casablanca (1944), Gene Kelly in Singing in the Rain (1952) and Henry Fonda in 12 Angry Men (1957). Alfred Hitchcock also failed to win an award despite five nominations. His enduring influence on the horror genre was finally recognised with an honorary gong in 1968. THE SHOW ALWAYS GOES ON Not even war has halted the glittering Hollywood event. There were calls for it to be cancelled in 2003 during the war in Iraq, but as it didn't stop during World War II or the Vietnam war.

Documentary winner Michael Moore ensured nobody forgot about the Iraq war though and used his acceptance speech to criticise the American invasion. The ceremony was muted with the glitz turned down and many female stars opting for demure dark dresses. The ceremony has been postponed on three occasions. Los Angeles floods in 1938 saw it put back a week. The death of Martin Luther King saw it postponed for two days in 1968 as a mark of respect and there was a 24-hour delay following the assassination attempt on President Ronald Reagan. CONTROVERSIES AND OTHER GAFFES Three people have refused Oscars, including actor George C Scott who said the whole thing was ""demeaning"". Writer Dudley Nichols refused his Academy Award in 1935 for his screenplay for The Insider because the Writers' Guild was striking at the time. Marlon Brando turned down his best actor Oscar for The Godfather in 1973 in protest as Hollywood's apparent discrimination against Native American people. He sent along a woman called Sacheen Littlefeather to collect his award. She was later revealed to be Native American actress Maria Cruz.

The following year Robert Opal interrupted proceedings when he streaked, flashing a peace sign as well as everything else. The TV network managed to pan away and avoid too much nudity. Opal was murdered in 1979. Frank Capra was the butt of one major gaffe in 1934 when the host opened out best picture envelope and declared ""come on up and get it, Frank"" to which Frank Capra bounded up to the stage before realising that he had meant Frank Lloyd had won for Cavalcade.

Capra vowed he would never to go the awards again but went the following year to collect his award for It Happened One Night.
"," The 77th annual Academy Awards are taking place on 27 February . The first ceremony was held in 1929 at a low-key dinner held at the Hollywood Roosevelt Hotel . Since its inception 2,530 Oscars have been handed out . There are 5,700 members of the Academy - with membership by invitation only ."
entertainment,"No jail for singer Courtney Love

Singer Courtney Love has been spared jail for assault and drug offences, but must serve three years probation.

She had back-to-back court appearances in two separate cases in Los Angeles, first pleading no contest to attacking a woman with a whisky bottle. In the second, Ms Love, 40, pleaded guilty to possessing a forged prescription and painkiller oxycodone. She must also do 100 hours community service, have drug treatment, attend Narcotics Anonymous and pay a fine. The ex-Hole singer's lawyer Howard Weitzman said Ms Love had ""turned her life around"" and she was ""clean and sober"".

The assault charge stemmed from April 2004, when Ms Love found musician Kristin King in her boyfriend's home. Ms King said the singer ""threw the bottle at the left side of my face"" in an ""angry, vicious and erratic"" attack. Ms Love was originally charged with the more serious offence of assault with a deadly weapon, but that was reduced to assault. Judge Rand Rubin said she must:

- Spend three years on probation 
 - Have one year's anger management counselling 
 - Have one year's drug rehabilitation 
 - Do 100 hours community service 
 - Pay $1,000 (£535) fine 
 - Have random drug tests 
 - Go to three Narcotics Anonymous meetings per week

In the drugs case, she was sentenced to 18 months probation, to run concurrently with the probation for the assault. That offence stemmed from October 2003, when she suffered an overdose after breaking a window at her boyfriend's home. In a separate case relating to the same incident, Ms Love was sentenced to 18 months in drug rehabilitation for being under the influence of cocaine and opiates. In another case last October, she pleaded guilty to disorderly conduct for hitting a man on the head with a microphone stand at a New York City nightclub. Last month her lawyers said she had won back custody of Frances Bean, her 12-year-old daughter with former Nirvana frontman Kurt Cobain. The girl was removed from her care following her double arrest in October 2003. Cobain committed suicide in 1994.
", Courtney Love pleaded guilty to two counts of assault and drug possession . She must also do 100 hours community service and pay a fine . She was originally charged with the more serious offence of assault with a weapon .
entertainment,"Abba reunite for musical premiere

The original stars of Swedish pop quartet Abba have reunited for the home premiere of hit musical Mamma Mia! which is based on the band's songs.

It is the first time in almost 20 years that the four, Bjorn Ulvaeus, Benny Andersson, Agnetha Faltskog and Anni-Frid Lyngstad, have met publicly. Faltskog has been a virtual recluse since the band split up in 1982. The musical, which has become a global phenomenon, will be performed in Swedish for the first time. Fans camped outside Stockholm's Cirkus theatre in the snow for a glimpse of the stars. The premiere marks Abba's first public reunion since the legendary band's acrimonious break-up in the early 1980s. It was thought that Faltskog would appear in London for the musical's fifth anniversary celebrations in April 2004 but she stayed away due to her fear of flying.

Original Abba member Bjorn Ulvaeus set about translating the musical into the band's mother tongue for the celebrated homecoming, alongside Swedish artist Niklas Stromstedt. Almost all of Abba's original songs, which have sold more than 350 million records worldwide, were written and recorded in English. The musical, set on a small Greek island, tells of the story of a young woman and her fiercely independent single mother. The show will include such classics as Super Trouper, SOS and Dancing Queen. There are currently 14 productions being staged worldwide, including New York and London, with road shows in Toronto, South Korea and Madrid. More than 20 million people around the world have seen the show.
", Swedish pop quartet Abba reunite for musical premiere of Mamma Mia! It is the first public reunion since the band's acrimonious break-up in the early 1980s . The musical will be performed in Swedish for the first time .
